Expert_Name,Expert_website,Old_Description,Expert_Description,Spreadsheet,Количество оценок,Градация оценок,Платность оценки (Free, Pay, Free/Pay),Expert_Facebook,Expert_Twitter,Expert_Youtube,Expert_TG_CHAT,Expert_TG_Group,Expert_Discord,Expert_Reddit,Expert_Medium,Expert_Bitcointalk_Forum,Expert_email,Subscribe,Комментарий
ICODog,https://icodog.io/top-rated-ico/,At ICODOG, we are determined to present cryptocurrency in its best light. Driven by our passion for ICOs, we give crypto lovers the opportunity to invest in the most promising ICOs and Masternode projects. At the same time, we ensure equality of opportunity for our members, enabling big and small investors to invest in promising crypto projects. ,,No data,100,От 1 до 100,No data,https://www.facebook.com/ICOdogg,https://twitter.com/ico_dog,https://www.youtube.com/channel/UC3mCDGGn-cdwL9YUlETcUxg,https://t.me/joinchat/HGS9zBFE0ecplvTcAYHAsQ,No data,https://discordapp.com/invite/TSbyEyY,https://www.reddit.com/user/ICODOG,https://medium.com/@contact_66179,No data,contact@icodog.io,Yes,
Midgard Research,https://midgardventures.com/,Midgard Ventures is the fund mostly oriented on projects in sphere of blockchain and crypto assets. Midgard Ventures is looking for fundamentally strong blockchain projects, which are able to disrupt major traditional centralized industries.,,https://cryptodiffer.com/person-midgard-research-ico,10,От 1 до 10,No data,No data,No data,No data,No data,No data,No data,No data,https://medium.com/@midgardventures,No data,info@midgardventures.com,No data,
ICODrops,https://icodrops.com/,ICODrops is our view on the constantly growing ICO world. We’ve created and are constantly updating three useful lists: Active ICOs, Upcoming ICOs and Ended ICOs for everyone who is interested in ICOs and wants to stay current on the topic. The lists look like a kanban board (Inbox, In Progress, Done).,ICODrops (https://icodrops.com/) is our opinion about the continually fast expanding ICO world. Our team developed and is regularly updating 3 helpful lists (Active ICOs, Upcoming ICOs and Ended ICOs) for all people who are involved in ICO investments and want to keep updated with market news. Our lists look like a dashboard (Inbox, In Progress, Done).,No data,5,Interest: low-neutral-medium-high-very high,Free,No data,https://twitter.com/ICODrops,https://www.youtube.com/channel/UCnueojzU1PqyYYcmxyG9aSA,https://t.me/joinchat/FoisO0k4-XXBkPEikfdgow,https://t.me/icodrops,No data,No data,No data,No data,hello@icodrops.com,https://icodrops.us3.list-manage.com/subscribe?u=4f1b4826ad6ab18d6070c8269&id=00588e7766,
Ian Balina,http://ianbalina.com/,Ian Balina is an influential Blockchain and Cryptocurrency Investor, Advisor, and Evangelist. He has appeared in The Wall Street Journal, Forbes, Huffington Post, The Street, INC and Entrepreneur Magazine for his work in analytics, cryptocurrencies, and entrepreneurship.,Ian Balina (http://ianbalina.com/) is a well-known blockchain and cryptocurrency investment manager, consultant, and blockchain technology evangelist. His reviews and ratings about crypto market and ICOs were published by the long list of famous media like Forbes, WSJ, The Street, Huffington Post, INC and Entrepreneur Magazine.,https://docs.google.com/spreadsheets/d/1BzJhrL_dEjrNE-LRbJZhubeMUF-8Pev7oaKM-qTDytE/edit#gid=1032094084,100,от 1 до 100%,No data,https://www.facebook.com/ianbalina/,https://twitter.com/diaryofamademan,https://www.youtube.com/user/Diaryofamademan,No data,http://ianbalina.com/mastermind/,No data,No data,No data,No data,ian@diaryofamademan.com,https://diaryofamademan.us15.list-manage.com/subscribe?u=ea269e8171520841ee355b594&id=eb982c4a0e,
OhHeyMatty,No data,Ex Professional Poker Player, Content Creator, Music Enthusiast, Computer Scientist, Cryptocurrency contributor, Youtube and Twitch Streamer.,OhHeyMatty. Hi, I'm a crypto enthusiast that want to show you the way ICOs are changing our ways of life. Insights, hottest news, top experts forecasts, in-depth analysis based on the algorithm developed by the team with strong skills in blockchain industry. OhHeyMatty - your guide to success in crypto assets.,https://docs.google.com/spreadsheets/d/1dQ0qMsV--Lso6EblkMY-Qs475U1awwY8Z4pgNfrWrFg/edit#gid=1040983530,100,от 1 до 100%,Free,No data,https://twitter.com/itsmeohheymatty,http://www.youtube.com/c/OhHeyMatty,No data,https://t.me/OhHeyMattyAnnouncement,https://discordapp.com/invite/Ah5Kx5s,No data,No data,No data,No data,No data,
CryptoBriefing,https://cryptobriefing.com/ico-reviews/,Our ICO reviews are independent and unpaid. We go deep to unearth the truth about the blockchain application of the ICO, its token distribution, the market and competition, and the price. ICO reviews from some sites are simply paid re-hashes of the whitepaper – ours are designed to help consumers sort the gems from the rubble. We believe that the crypto community needs, and deserves, the kind of objectivity that we provide – and we work hard to earn your donations.,CryptoBriefing's ICOs reviews and ratings (https://cryptobriefing.com/) are independent and unrewarded. The ICOs are covered in details in our reports to unveil the truth about the app of the ICO, its token circulation, the market and competitors, and the value. Most of the ICO reviews on the cryptomarket are copied from the whitepapers – while CryptoBriefing's ICOs reviews and ratings are created to help customers sort the jewels from the rubble. Our team does believe that the cryptomarket requires, and deserves, a sort of high-quality reviews that we do – and our team works really hard 24/7 to get rewarded by your donations.,No data,100,от 1 до 100%,Free,https://www.facebook.com/cryptobriefing,https://twitter.com/crypto_briefing,No data,https://t.me/cryptobriefingsupporters,https://t.me/cryptobriefing,No data,No data,No data,https://bitcointalk.org/index.php?topic=2262943.0,info@cryptobriefing.com,Yes,
MMCrypto,https://mmcrypto.io/,Follow us on our journey. Together we find hidden ICOs, like needles in a haystack. ,MMCrypto (https://mmcrypto.io/) MMCrypto offers access to its free Spreadsheet that is updated on a weekly basis. But still, we remind that spreadsheet is only information, not the financial advice and MMCrypto's team is not a financial advisor. Investors must always do their own research and invest only at their own risk.
,https://docs.google.com/spreadsheets/d/18q2w77MGSnDGtnoY5K58eYB5AjEHORxdLbDJaB__QtU/edit#gid=648907179,100,от 1 до 100%,No data,https://www.facebook.com/groups/MMCrypto.io/,https://twitter.com/MMcrypto,https://www.youtube.com/channel/UCBkGMys0mYl3Myxh3CTsASA,https://t.me/MMCryptoENG,https://t.me/MMCryptoALERTS,No data,No data,https://medium.com/@mmcrypto,No data,info@mmcrypto.io,No data,
Mandy,http://cryptosdaily247.com/,My name is Mandy and my passion is to help everyone Understand Blockchain find promising ICO's & Crypto Currencies. I have been a Investment Banker for past 10 years and worked with reputed Banks.,My name is Mandy and here's my website http://cryptosdaily247.com/ My goal is to assist everyone with understanding blockchain technology to discover the most promising ICO's & Crypto Currencies. For the last ten years I've been an investment banker at the most well-known banks around the world.,https://docs.google.com/spreadsheets/d/1MjhiUslFV9bnKSWG7ElCA11B2xxFEbJRzMZ7wmhJrTE/edit#gid=1671177910,10,от 1 до 10,No data,https://www.facebook.com/cryptosdaily247/,https://twitter.com/mandyb675,https://www.youtube.com/channel/UCESKqHR1VHRw5y300gpHXDQ,No data,https://telegram.me/mandysicoresearch,https://discordapp.com/invite/GrTP7nK,No data,No data,No data,No data,No data,
Wolf Crypto,https://wolfcrypto.net/ico-reviews,Wolf Crypto bases the category weight significance on a combination of examining past performances and current trends, while attempting to be as objective as possible. The final rating is capped to a max value of 100. To be able to reach that value, a project would need to get top ratings in all categories, which is very difficult to do. Receiving less than that value in no way means that the project will not be sucessful.,Wolf Crypto (https://wolfcrypto.net/) develops its rating and reviews of the ICO project on a mix of considering past achievements and current trends, and the team is doing it's best to provide you the most transparent and detailed reviews. The final ICOs rating has a maximum grade of 100. To get an ability to earn that grade, an ICO project will need to get top rankings in all categories, while it is very challenging to do. But still, not gaining that grade doesn't mean that the ICO project will not succeed.,https://docs.google.com/spreadsheets/d/e/2PACX-1vRVavikv_-LdgqN1I6mGWoI3b6LSg4mmruz7pc85BF57eUnIMZPamhoPJihOJxLCFrpWEHtAVC14Nvv/pubhtml?gid=1260768380,100,от 1 до 100%,No data,No data,https://twitter.com/wolfcryptogroup,https://www.youtube.com/channel/UCM6bmZ7FLpEEeVUW7aqL59A,https://t.me/WolfCryptoPub,https://t.me/WolfCryptoAnnounce,https://discordapp.com/invite/teS68qn,https://www.reddit.com/r/wolfcrypto/,https://medium.com/wolf-crypto,No data,info@wolfcrypto.net,Yes,
Sergio,https://sergioico.com/,Specialized on ICO reviews (Initial Coin Offerings) and new disruptive blockchain technologies.,Sergio (https://sergioico.com/) My ratings and spreadsheet are for informational purposes only and are not financial advice in any case. You must do your own research and consider the risk levels before you take any investment decision related to ICOs. Also, I must notice, that there are scammers that try to impersonate me. Only trust @SergioICO username on Telegram and double-check it!,http://spreadsheet.sergioico.com,100,от 1 до 100%,No data,https://www.facebook.com/people/Sergio-Garcia/100025769297832,https://twitter.com/sergiogarciafer,https://www.youtube.com/SergioICO,https://t.me/SergioICOReport,https://t.me/SergioICOReport_ANN,No data,No data,https://medium.com/@sergiogarciafer,No data,hello@sergioico.com,No data,
Crypto Calibur,https://cryptocalibur.com/,CryptoCalibur aims to provide the most in-depth reviews out there and help investors stumble across the early gems. Our research team utilises about 50 metrics in order to analyse and rate projects. Each metric is rated on a likert-scale ranging from 1 to 5.,CryptoCalibur (https://cryptocalibur.com/) team tries to provide the most detailed ICO reviews on a blockchain market and assist investors to find the promising early birds among the long list of ICOs. CryptoCalibur R&D team uses up to fifty different metrics to examine and rank ICO projects. Each of the used parameters is evaluated on a Likert-scale from one to five.,No data,100,от 1 до 100%,No data,https://www.facebook.com/cryptocalibur/,https://twitter.com/CryptoCalibur,https://www.youtube.com/channel/UCBdKkSqJ3UuKTJtOanZpZIg,https://t.me/cryptocaliburchat,https://t.me/cryptocalibur,No data,No data,https://medium.com/@caliburcrypto,No data,No data,No data,
Diddy Carter,No data,I entered the crypto space June 2017. My first five crypto currencies were ethereum, ark, lisk, xrp and omg. Shortly after these purchases, the market went bullish and I started making so much money I couldn't believe how easy it was. Then I got into ICOs, some people found out I was super good at picking profitable ones so they urged me to start a telegram channel. Fast forward 6 months from June 2017 and I've made a name for myself at the age of 24. I currently now advise , advertise, provide influence and marketing for icos. ,I'm an ICO expert Diddy Carter. I have discovered a crypto world in June 2017. The first 5 cryptocurrencies I've invested in were ethereum (ETH), ark (ARK), lisk (LSK), xrp (XRP) and omg (OMG). Soon after these investments, the crypto market went bullish and I began earning so much cash I couldn't believe how simple it was. Then I dived into ICOs galaxy, and some market makers noticed that I was pretty good at choosing successful ones so they inspired me to launch my Telegram channel related to ICOs ratings and reviews. In half of a year after June 2017 and I became a self-made ICO expert at the age of only 24. I'm currently advising, promoting and creating the marketing strategies for ICOs projects. ,https://docs.google.com/spreadsheets/u/1/d/e/2PACX-1vTwjlWe-otOK92dIO47ibW63ib5dWwdQHyIfbuuVVAJyj6CnIj8fm4FzCwdtUeV7KcfTx-iCDFB6yiu/pubhtml,6 и 100,EXCELLENT (A), SOLID (B+), PROMISING (B-), OKAY (C), AVERAGE (D), BAD (E-F) / от 1 до 100,No data,https://www.facebook.com/diddycarterico,https://twitter.com/DIddycarterIco,https://www.youtube.com/channel/UCOzhbkDyXWp1rRd4d3B6SYw,No data,https://t.me/diddycarterico,https://discordapp.com/invite/eWRSEna,https://www.reddit.com/user/diddycarter,https://medium.com/@diddycarterico,No data,No data,No data,
Shin Chan,No data,My spreadsheet is passed on several factors that I take into conderation along with market conditions, those conditions are: 1.Ideas, Project type 2.Roadmap 3.MVP/Prototype 4.Team 5.Advisor 6.Hardcap 7.Total token, Total sale token, Token per price 8.Largest Bonus 9.Locked-up Period 10.Dump Alert. Every review of mine comes with notes that I find important to share to my followers, information that may not be easily found or that deserve to be highlighted on their own.,I am an ICO expert Shin Chan. My ICOs spreadsheet is based on the several metrics that I consider together with the ICOs strategy: 1) An idea that stands behind and ICO project type; 2) A long-term roadmap; 3) A minimum viable product or prototype; 4. An ICO project team; 5) The list of advisors; 6)Hardcap; 7) Total tokens quantity and value, total tokens for sale, price per token; 8) The biggest possible bonus; 9) A locked-up term; 10) Dump Alert. Every my ICO review or ICO rating delivered with records that I find necessary to share with the readers, data that might be hidden or that must be highlighted.,https://docs.google.com/spreadsheets/d/e/2PACX-1vTzsYbWEqEvUYlSfSpjIpHlvI5JUchzw1RQMnOYMXzCO_AD6LieVpusB9aVV1HOJk7yjzZrONZz6RaI/pubhtml#,100,от 1 до 100%,No data,No data,No data,No data,https://telegram.me/shinchanICO_CN,https://telegram.me/moonwithshinchan,No data,No data,No data,No data,No data,No data,
Lendex0,No data,Cryptospace astronaut. Passionate about crypto future. All-in #crypto investor, reviewer and analyst.,Lendex0. I'm an investor that is excited with blockchain technology. I've started my ICO spreadsheet to share with you my experience and help you to make the right investment decisions. ICO market is a quite complicated thing, you can find hundreds of ICO experts that will try to help you with the reviews or rankings, but most of them had never invested even a dollar. While my ICO reviews are built on the real experience.,https://docs.google.com/spreadsheets/u/1/d/e/2PACX-1vScEz0nAEoBr9a7aJ5qKEsdIzORuycAzWjDpSwCa-jHnNLpyXyrzwv2_1l69gfLEutLIY4XVLmQklMV/pubhtml#,100,от 1 до 100%,No data,No data,https://twitter.com/lendex0,No data,No data,https://t.me/x0ann,No data,No data,https://medium.com/@lendex0,No data,No data,No data,
Coin Bloq,https://www.coinbloq.com/,As a cryptocurrency investor, I created this spreadsheet to share my successes, failures and experiences of dealing with a volatile and often complex asset - cryptocurrency. Coin Bloq eschews the abstraction of technical indicators to focus on the richer fundamental aspect of investment decision-making. Coin Bloq will teach you how to avoid shady projects and scams - filtering out the hype and fleshing out the detail.,Since I’m an experienced manager of crypto-assets like cryptocurrencies and ICOs I’ve made the decision to share my results, gains, and losses to help you avoid my mistakes and explore successful cases about cryptocurrency. Coin Bloq abstains from the technical analysis and its doubtful indicators and lets investors get more concentrated on well-grounded fundamental factors to take the right decisions in crypto-assets management. Coin Bloq - no hype, but the informed decisions.,https://docs.google.com/spreadsheets/d/1BJVPSl6DuMD96OlR5QSUw06qhkfMYsqwtqbz4Ry_rrQ/edit#gid=145457711,4,Cash Cow, Bullish, Neutral, Negative,Free,No data,https://twitter.com/CoinBloq,https://www.youtube.com/channel/UCrsEzLxi1oxHr6xW9S5vSzg,https://t.me/CoinBloqGroup,https://t.me/CoinBloqAlerts,No data,No data,https://medium.com/@CoinBloq,No data,No data,No data,
CrushCrypto,https://crushcrypto.com/,Crush Crypto is an independent research group focused on blockchain technology and digital currencies such as Bitcoin and Ethereum. The goal of Crush Crypto is to provide high quality and objective fundamental analysis in cryptocurrency investing. We are not paid or mandated to do any of our reviews and do not provide any promotional or advertising services. Our content is based on our own research, analysis and personal opinion, and the projects that we choose to review are based on our discretion.,Crush Crypto (https://crushcrypto.com/) is an experienced and well-known ICO research team of professionals in blockchain technology and cryptocurrency market, especially Bitcoin (BTC) and Ethereum (ETH). Crush Crypto ICO team aims to produce high-quality and accurate fundamental ratings and reviews in cryptocurrency market. We are not rewarded by any ICO project or crypto investor for our reviews, and Crush Crypto doesn't do any promotion or advertising for ICOs. Our ICO rating and reviews are based on our ICO researches, own metrics and an opinion of our experienced team, and the ICO projects that were picked for a review are a matter of our individual decision.,https://crushcrypto.com/summary/,3,S/A (positive), B/C (neutral), D (negative),Free,https://www.facebook.com/crushcrypto/,https://twitter.com/CrushCrypto,https://www.youtube.com/CrushCrypto,No data,https://t.me/joinchat/AAAAAESrVCwzd19x1DvDOQ,No data,No data,No data,No data,No data,Yes,
Picolo,https://picoloresearch.com,Picolo Research is a private and independent research house incorporated in Singapore through its parent company Picolo Ventures PTE LTD. Picolo prides itself as being one of the leading research houses in crypto markets, specializing in Initial Coin Offerings and emerging tokens. Our goal is to bring transparency and confidence to investors that are seeking exposure to blockchain backed assets.,Picolo Research (https://picoloresearch.com) is a privately held company with an independent research team launched in Singapore by its proud of itself as one of the most experienced research companies in crypto market, with a focus on ICOs and emerging projects. Our aim is to provide investors with transparent reviews and ratings of ICOs, cryptocurrencies and other crypto assets.,No data,4,avoid-neutral-buy-speculative buy,No data,No data,https://twitter.com/picoloresearch,No data,No data,No data,No data,No data,No data,https://bitcointalk.org/index.php?action=profile;u=1052243,admin@picoloresearch.com,Yes,
CryptoBotReport,No data,I created this spreadsheet to share my cryptocurrency investment experience. It is an experiment. I try to be as transparent as possible.,CryptoBotReport. I've made this ICO spreadsheet to share with the crypto community my investment experience in crypto economy. It is an experiment with an unclear outcome. I do my best to stay as transparent as possible and do the in-depth researches before I post any ICO review. I hope you will enjoy it and use this opportunity to build your own investment portfolio.,https://docs.google.com/spreadsheets/d/1ltptPUQzSn7U1OrPf_WXibLZfS02eSR83hS5vYGzRSQ/edit#gid=0,100,от 1 до 100%,No data,https://www.facebook.com/CryptoBotReport/,https://twitter.com/pawedo,https://www.youtube.com/channel/UCo6ix30E35cgwo_KImLa1cA,No data,https://t.me/cryptobotreport,No data,No data,No data,No data,No data,No data,
Liu,No data,Cryptocurrency Investor and Influencer.,My name is Liu. I started my journey on the ICO market 5 years ago. During this time I had a lot of successful projects, but there were also losses. This was the reason for me to share with you my experience. Check my ICO spreadsheet, I hope it will help you to evaluate ICO projects and find the most promising ones.
,https://docs.google.com/spreadsheets/d/e/2PACX-1vQ5bWB8S3ZZRWMVdHDiauGcp0Cvcr7obQPjS7Etp_uJBLGtYCfdCxshHXRJlGu-dmKMkWKdfxx_tkvx/pubhtml#,100,от 1 до 100%,No data,No data,https://twitter.com/liu_cryptos,No data,https://t.me/liucryptos,https://t.me/LiuCryptoAlerts,No data,No data,https://medium.com/@liucryptos,No data,No data,No data,
CryptoRated,https://cryptorated.com/ico-reviews/,At CryptoRated, our job is to carefully scrutinize every ICO to ensure that whoever seeks to invest has all the information needed to make the right judgment call founded on facts and data.,CryptoRated (https://cryptorated.com/) At CryptoRated, our task is to accurately examine every ICO to assure that anyone who seeks to invest in crypto has all the data and analysis to make the right investment decision built on checked facts and big data analysis. CryptoRated - a comprehensive initial coin analysis and ratings.,https://docs.google.com/spreadsheets/d/1wuZgD9J2ksGPm5e-rCl0fhesqxbmQa6aaF7bDbb_TVU/edit#gid=1614011223,5,от 1 до 5,Free/Pay,https://www.facebook.com/icoreviews/,https://twitter.com/CryptoRatedHQ,https://www.youtube.com/channel/UCVSJUCoPh0iSWZkUdV_jAJw,https://t.me/CryptoRated,No data,No data,https://www.reddit.com/r/icoreviews/,https://medium.com/@ico_reviews,https://bitcointalk.org/index.php?action=profile;u=1081201,info@cryptorated.com,Yes,
Token Metrics Report,No data,Token Metrics is a project dedicated to the independent, unpaid and transparent analysis of projects that are building products using blockchain technology and vc funds specialized in partnering with such projects.,Token Metrics Report. Token Metrics is a ICO analysis website with an independent, outstanding and transparent team and technology that offers information related to products using blockchain technology and venture capital funds focused on investments in initial coin offering. Token Metrics Report - your guide to the world of crypto economy.,https://docs.google.com/spreadsheets/d/1LTVy4TnuPfclZNQzkVf8gVVZBrr-XVphd_DOQX8PRKg/edit#gid=1599422074,12,S,A+,A,A-,B+,B,B-,C+,C,C-,D,E,Free,No data,https://twitter.com/Token_Metrics,No data,No data,https://t.me/token_metrics,No data,No data,https://medium.com/@tokenmetrics,No data,konstantin@tokenmetrics.io,No data,
ICOBazaar,https://icobazaar.com/v2/list/featured,ICObazaar.com is one of the leading ICO trackers providing independent rating and reviews of trending ICOs since 2017. Our listed database is 4500+ projects with over $ 1 bln raised. Our ICO rating evaluates the overall quality and viability of the product, team, and technical implementation behind. It is calculated with a weight-adjusted formula with five factors and a separate industry expert score. Each factor evaluates an aspect of the project and its weight is related to its importance, which was determined by blockchain and finance professionals.,ICObazaar (https://icobazaar.com/) team is one of the most well-known ICO experts in the world that releases independent ratings and reviews of the most promising ICOs. ICObazaar's database includes 4,5K CO projects with over 1'000'000'000 USD raised. ICObazaar's ICO rating covers a long list of project properties like quality and search/market visibility, its team, and blockchain technology that stands behind it. ICO ratings are measured with a weight-adjusted method based on 5 metrics and an individual industry expert grade. Each parameter evaluates characteristics of the project and its weight is related to its value, which was determined by crypto assets managers.,No data,5,от 1 до 5,Pay,https://www.facebook.com/icobazaar,https://twitter.com/icobazaar,https://www.youtube.com/channel/UCv926YsasRYaAE3EK_g1Zvw,No data,https://t.me/icobazaar,No data,https://www.reddit.com/r/ICObazaar/,https://medium.com/icobazaar,https://bitcointalk.org/index.php?topic=1944524.0,hello@icobazaar.com,Yes,
TokenTOPS,https://tokentops.com/rating/,The easiest way to find interesting projects with possible potential for profit is to sort ICOs listed on TokenTops based on their general rating. This list include both past and currently active token sales. There are many things and variables that contribute to the final ICO rating.,TokenTOPS (https://tokentops.com/) - the most simple way to discover exciting ICO projects to get profit is to sort ICOs listed on https://tokentops.com/ powered by their independent market ratings. That list of ICOs includes both past and currently running token sales. There are many metrics, parameters and variable data that is being contributed to the ultimate ICO rating.,No data,5,от 1 до 5,Free,No data,https://twitter.com/tokentops?lang=ru,No data,No data,https://t.me/tokentops,No data,No data,No data,https://bitcointalk.org/index.php?topic=2076106.0,support@tokentops.com,Yes,
