ICOData,https://www.icodata.io/ICO/active,Our proprietary rating system is designed to give our readers an independent and unbiased overview of the project and provide them with all the necessary data about specific ICO at one place. All details of the project are given a score which determines the final rating based on our proprietary model.,ICO Data (https://www.icodata.io/) - our exclusive ICO rating method was developed to offer crypto investors an independent and full summary of the ICO project analysis and provide them with all the essential information about specific ICO in one place. All aspects of the ICO project are provided with a score which defines the final ICO rating based on our exclusive ICO analysis model.,No data,100,от 1 до 100,No data,https://www.facebook.com/icodata.io/,https://twitter.com/ico_data,No data,https://t.me/icodataio,https://t.me/icodatachannel,No data,No data,https://medium.com/@icodata.io,No data,No data,Yes,
ICOMarks,https://icomarks.com/icos,ICOmarks is an independent platform for the analysis and research of ICO (Initial Coin Offering). We have our own rating system that we use to compile a list of the most promising projects, a calendar of upcoming/ending ICOs, and a tool for tracking token stats that are already being traded. Every day dozens of new ICO projects are made public, and our mission is to provide investors with independent and transparent information about each ICO so that they can minimize their investment risks. ,ICOmarks (https://icomarks.com/) is an independent app for the examination and analysis of ICOs. Our research and development team has created the rating methodology that is used in the process of compilation of the listing of most promising ICO projects, a schedule of upcoming/ending ICOs, and a tool for following token's trading statistics data. Every week hundreds of new ICO projects are going public, and ICOmarks's mission is to provide investment managers with objective and transparent data, reviews and ratings about every ICO so that they can decrease their financial risks.,No data,10,от 1 до 10,Free,https://www.facebook.com/icomarks,https://twitter.com/ICO_marks,No data,No data,https://t.me/ico_marks,No data,No data,https://medium.com/@icomarks,No data,No data,Yes,
TrackICO,https://www.trackico.io/,TrackICO provides its users the most reliable information about the best ICO projects and helps ICOs become more successful.,TrackICO (https://www.trackico.io/) TrackICO is a digital media website with the range of analytical data related to ICO projects, ICO rankings and reviews. TrackICO supports crypto investors with the double-checked information to help them avoid risky ICOs and become more successful. Our team consists of tens experts in ICO market that post ICO reviews on the daily basis.,No data,5,От 1 до 5,Free,https://www.facebook.com/TrackICO/,https://twitter.com/TrackICO,No data,No data,https://t.me/trackico,No data,No data,https://medium.com/@trackico,https://bitcointalk.org/index.php?topic=2254980.0,No data,Yes,
ICO Market Data,https://www.icomarketdata.com/earlybird,ICO Market Data is a comprehensive ICO platform offering a useful way of filtering scams and making sense of the current ICO landscape. Our rating methodology is based on independent research, and is designed to provide a qualitative overview on various ICOs. Perhaps more important, it is a necessary effort to educate the crypto community, and help establish some best practices to strive towards. We attempt to kill scams and call out on money-grab ICOs by introducing some reasonable and objective, although yet still preliminary, standards to evaluate things by. Additionally, our goal is to create a clear, concise, and informative framework, allowing our community to make educated decisions in a highly dynamic and rapidly changing environment.,ICO Market Data (https://www.icomarketdata.com/) is a professional ICO-investment consulting web app allowing investors to filter scams and discovering the landscape of ICOs. ICO Market Data's rating methodology is based on our independent financial and management metrics and is created to provide the high-quality reviews of different ICOs. What's more notable, it is a significant attempt to educate the crypto market, and help set some reliable methods to strive towards. ICO Market Data tries to alert scams and call out on money-grab ICOs by submitting some reasonable and transparent, but still just a preliminary, models to estimate things by. ICO Market Data mission -  is to create a transparent, brief, and advisory framework, allowing crypto market investors to make the right decisions in a highly progressive and fast-changing blockchain market conditions.,No data,5,от 1 до 5,No data,https://www.facebook.com/icomarketdata/,https://twitter.com/ICOMarketData,No data,https://t.me/icomarketdata,No data,No data,No data,https://medium.com/@IcoMarketdata,No data,contact@icomarketdata.com,Yes,
ICOGuru,https://icoguru.io/,ICOguru is the most comprehensive and updated ICO list, offering you a list of upcoming ICO projects alongside with lists of Pre-ICO, and Current ICOs, wherein you can find all necessary data regarding projects launching their Crowd sales. Every day new coins are coming out and on this page, you’ll see only upcoming initial coin offering. To provide you with the most convenient service, we've developed our own consolidated rating! All worth rating providers are collected in one place (e.g ICOrating, ICObench and so on). Each project will have up to 8 different ratings (including a personal rating by ICOguru). Our methodology includes a detailed analysis of each project, so our rating is very objective.,ICOguru (https://icoguru.io/) - is one of the most complete and regularly updated ICO listings, that offers crypto investors a unique list of upcoming ICO projects together with lists of Pre-ICO, and Current ICOs, where users can read all important data about projects that are starting their ICO. Every week new ICOs are coming out, and on the pages of ICOguru, investors can get the list of the freshest upcoming projects. To offer crypto investors the most useful service, we've created our special consolidated ICO rating! All well-known and trusted rating providers are gathered in one place (for example, ICOrating, ICObench, etc.). Every ICO project is published with to eight different ratings (including a special rating by ICOguru). ,No data,5,от 1 до 5,No data,https://www.facebook.com/icogurulisting/,https://twitter.com/guru_ico,https://www.youtube.com/channel/UCXjjewhFFBVAXwa5Sp93tzg,No data,No data,No data,No data,https://medium.com/@only.human.welsh,https://bitcointalk.org/index.php?topic=2803837.0,info@icoguru.io,Yes,
ICOScoring,https://icoscoring.com/,The ICOscoring platform is based on a team with extensive experience in the field of direct and venture investments, as well as analysis of investment in the blockchain infrastructure. We believe that the blockchain economy should be as transparent as possible for all its participants and set a goal to simplify the procedure for selecting investment-attractive projects that conduct ICO by providing analytics on the basis of Big Data and the classical approaches that are used in the venture industry. The provided assessments take into account the main risks and uncertainties of the project, which allows you to increase the security of your investments in the ICO.,ICOScoring (https://icoscoring.com/) - a web application developed by an experienced team of professionals in the venture and direct investments, as well as expertise in investment in the crypto technologies. ICOScoring team does believe that the crypto economy must be as transparent as possible for all its members and set an aim to explain the method for choosing investment-attractive ICO projects by presenting metrics based on Big Data and the traditional procedures that are used in the high-risk investment industry. The provided estimations take into account the principal risks and dilemmas of the ICO project, which allows the investor to decrease the risks of the investment portfolio of ICO related assets.,No data,5,от 1 до 5,No data,No data,https://twitter.com/ICOSCORING_team,No data,No data,https://t.me/ICOscoring,No data,No data,https://medium.com/@ICOscoring,https://bitcointalk.org/index.php?topic=2193530.0,hello@icoscoring.com,Yes,
ICONow,https://iconow.net/category/ico-control/,ICOnow.net - ICO rating and listing, Bounty listing, airdrop and crypto news.,ICONow (https://iconow.net/category/ico-control/) ICOnow - is a web application with an ICO rating and listing, Bounty listing, and news about crypto market. Our team browses through hundreds of websites related to ICO niche every day to provide you the hottest news and opportunities to invest and become a part of crypto community.,No data,100,от 1 до 100,Pay,https://www.facebook.com/iconow/,https://twitter.com/iconow_net,No data,No data,No data,No data,https://www.reddit.com/user/ICOnow/,https://medium.com/@iconow,https://bitcointalk.org/index.php?topic=2202209.0,m@iconow.net,Yes,
CCN,https://www.ccn.com/ico/,CryptoCoinsNews (CCN) is a site providing news coverage around cryptocurrencies including bitcoin. It is a source of cryptocurrency news, with writings cited in publications of economics and medicals.,CryptoCoinsNews (https://www.ccn.com/) CryptoCoinsNews (CCN) is a website and digital media agency that provides news about cryptocurrencies and the major of it - BTC. CryptoCoinsNews is a source focused on articles and reviews of initial coin offering project that work in the economic and medical sector.,No data,10,от 1 до 10,No data,https://www.facebook.com/ccn.la/,https://twitter.com/cryptocoinsnews,https://www.youtube.com/channel/UCwUBI86ypBSo_A63IMrjhfQ,No data,No data,No data,No data,No data,https://bitcointalk.org/index.php?action=profile;u=127390,jonas.borchgrevink@ccn.com,Yes,
ICOReview,https://icoreview.ru/calendar/,Наш проект — это новый информационный ресурс, на котором вы всегда можете найти свежие новости об ICO, криптовалюте и в целом о любых событиях blockchain индустрии. Также мы обозреваем интересные ICO, анализируем стартапы, рассказываем новичкам об инвестировании в ICO на собственном опыте, публикуем советы экспертов.,Our project is a new digital web source where you can always find the latest news about ICOs, cryptocurrencies and general news about any events in the blockchain industry. We also review interesting initial coin offerings, analyze startups, explain inexperienced newcomers the complicated issues about investing in ICO, and post expert tips.,No data,5,от 1 до 5,No data,https://www.facebook.com/groups/icoreview,https://twitter.com/ICOreviewRU,No data,https://t.me/ICOreviewChat,https://t.me/ICOreviewRU,No data,No data,No data,No data,info@icoreview.ru,https://icoreview.ru/calendar/#emaillink,
ICO-rating,ico-rating.ru/,Все о криптовалюте. Рейтинг и оценка новейших и доходных ICO со всего мира.,ICO-rating (https://www.ico-rating.ru/). Our website is a tool for ICOs and investors of the crypto economy. We provide ICO rating based on aggregated data from the top ICO sources. ICO-rating has 3 types of ratings: upcoming ICOs, ongoing ICOs and ended ICOs. For ICO founders we offer the next services:
- express, fast or regular listing;
- featured ICOs;
- ads placement.,No data,5,от 1 до 5,Free,No data,No data,No data,No data,No data,No data,No data,No data,No data,No data,No data,оценку выставляют пользователи
ProfitGid,https://profitgid.ru/icorating,Наша команда собирает свежую информацию со всего интернета для того, чтобы предоставить пользователям актуальную информацию. Наш рейтинг несет лишь ознакомительный характер. Это своеобразный календарь ICO криптовалют, который позволит быстро ознакомиться с текущими и предстоящими проектами. Окончательное решение об инвестирование принимает инвестор.,Our team collects the latest news from all over the Internet in order to provide users with relevant information about ICOs. Our ICO rating is for informational purposes only. Our service is a kind of ICO cryptocurrency calendar that will allow you to get notified with current and upcoming ICO projects faster than the market. Remember: the investor makes the final investment decision.,No data,100,от 1 до 100,Free,https://www.facebook.com/profitgidru/,https://twitter.com/profitgidru,https://www.youtube.com/channel/UC9JQcfLxO13Y8P05sKf_Y2Q,No data,https://t.me/profitgidtop,No data,No data,No data,No data,my@profitgid.ru,No data,оценку выставляют пользователи
ICO4you,https://ico4you.com/,ICO4YOU is a rating portal that provides information about blockchain-based projects. We evaluate startups which are planning ICO (initial coin offering) using the special scale. The result shows the real rating of each project. The scale consists of different characteristics which indicate the investment attractiveness of blockchain-startups. ICO4YOU goal is to provide investors clear and transparent information with reasonable investment rating. As a result investors could make decisions based on facts and true information about the project. It will increase the level of trust and confidence between users, investors and developers. ICO4YOU uses 13-point scale of rating, giving projects the evaluation from 1 to 10. ,ICO4YOU (https://ico4you.com/) is an ICO rating web service that is publishing data related to ICO projects. Our team estimates enterprises with plans for ICO (initial coin offering) using our unique ICO rating. As an outcome, this rating shows the real evaluation of each project. The rating includes different characteristics which indicate the investment attractiveness of ICOs. ICO4YOU aim is to supply crypto investors with clear and transparent analysis with objective investment rating. This results in smart investment decisions.,No data,10,от 1 до 10,No data,https://www.facebook.com/ico4y/,No data,No data,No data,https://t.me/ico4you,No data,No data,No data,No data,hi@ico4you.com,No data,
BitCryptoNews,https://bitcryptonews.ru/ico-rating,BitCryptoNews – портал о важных событиях на криптовалютном рынке, мы предоставляем нашим читателям критический и независимый обзор о криптовалюте, блокчейне ICO. В нашем рейтинге собраны все проекты, мы разработали специальные критерии для оценки ICO, по каждому критерию выставляются баллы и даются рекомендации. Есть удобный поиск и сортировка по различным параметрам. Все проекты оцениваются по 100 показателям, для удобства объединенных в 20 пунктов, максимальное количество баллов 100.,BitCryptoNews is a web portal about important events in the cryptocurrency market, we provide our readers with the independent reviews of cryptocurrency, ICOs, and blockchain. In our ICO rating you will find all existing ICOs on the market, we have developed special criteria for evaluating the ICOs. There are a useful search and sorting by various parameters. All projects are evaluated by 100 indicators, for convenience combined into 20 points, the maximum number of points is 100.,No data,100,от 1 до 10,No data,https://www.facebook.com/bitcryptnews/,https://twitter.com/BitCryptoNews1,https://www.youtube.com/channel/UCP33LgzVeqbXRwgQ9wPka5g,No data,https://t.me/joinchat/AAAAAERDkwllTa4BWzV_Kg,No data,No data,No data,No data,Olga@bitcryptonews.ru,No data,
BitExpert,https://bitexpert.io/rating-ico/,Узнать об актуальных ICO и дать объективную оценку перспективности проекта можно в рейтинге от bitexpert.io. Команда портала собирает, анализирует и систематизирует всю доступную информацию об актуальных ICO. Рейтинг будет полезен инвесторам, заинтересованным во вложениях в перспективные криптовалюты и блокчейн-проекты. В списке представлены ICO, которые либо должны состояться в ближайшее время, либо уже начались. Таким образом, криптоинвестор может на основе предоставленных данных определиться, стоит ли проект вложений, а также сориентироваться по временным рамкам.,Find out about ongoing ICOs and get an objective evaluation of the prospects of the project in the rating on bitexpert.io
Our team collects, analyzes and organizes all available information about ongoing ICOs. The ICO rating will be useful to investors interested in the most promising cryptocurrencies and blockchain projects. The list includes initial coin offering projects, which should either take place shortly or have already begun.,No data,10,от 1 до 10,Free,https://www.facebook.com/bitexpert.io,https://twitter.com/bitexpert_io,https://www.youtube.com/channel/UCfNWTyjdYrEOOy77rq-voqg,https://t.me/bitexpertchat,https://t.me/bitexpertlive,No data,No data,No data,No data,ask@bitexpert.io,No data,оценку выставляют пользователи
ICO Digest,https://ico-digest.com/upcoming-ico,Каталог ICO-Digest.com ставит своей целью предоставление пользователям полной и достоверной информации о проводимых и готовящихся ICO. В фокусе внимания находятся наиболее интересные и перспективные проекты, независимо от их географической, национальной принадлежности и юрисдикции.  ICO-Digest.com видит свою задачу, в первую очередь, в том, чтобы предоставить максимально объективную информацию по широкому спектру ICO проектов. Для этого мы изучаем данные, предоставляемые ICO проектами, аналитическими ресурсами в сети интернет, сотрудничаем со специалистами инвестиционных агентств и профессиональными консалтинговыми компаниями.,The ICO-Digest.com catalog aims to provide users with complete and reliable information about ongoing and upcoming ICOs. The focus is on the most exciting and promising ICO projects, regardless of their geography or jurisdiction. ICO-Digest.com sees its goal, first of all, in providing the most objective information on a wide range of ICO projects. ,No data,5,от 1 до 5,No data,https://www.facebook.com/bitnovosticom,https://twitter.com/bit_novosti,https://www.youtube.com/user/bitnovosti,No data,https://t.me/icodigestcom,No data,No data,No data,No data,No data,No data,
TokenLab,tokenlab.info/,Our main goal is to provide crystal clear assessment of upcoming and ongoing projects on the market. Each evaluation is set manually and adjusted later when it changes. We do not use data parsing to avoid errors. We developed TLI (TokenLab Index) - index calculated by more than 20 parameters for companies which are planning to launch an ICO and token sale or have already done it. Each rating in the index has several criteria — weighting factors. They depend on the importance of the object.,TokenLab (http://tokenlab.info/) - Our team's primary intention is to provide a transparent assessment of ongoing and upcoming ICO projects on the crypto market. Every ICO evaluation is set manually by our team and corrected later when it runs through changes. Unlike other ICo analysis services, our score is not based on the parsed data, it helps us to avoid errors. Our team has launched TLI (TokenLab Index) - index that includes more than 20 characteristics for startups that plan to start an ICO and token sale or have already done it.,No data,100,от 1 до 100,No data,https://www.facebook.com/tokenlab.info/,https://twitter.com/tokenlab_info,No data,https://t.me/tokenlab_chat,https://t.me/Tokenlab_info,No data,No data,No data,https://bitcointalk.org/index.php?topic=2212112.0,hello@tokenlab.info,No data,
ICOHotSheet,https://icohotsheet.com/,Scoring is based on:
* idea: how original and groundbreaking is the idea
* team: do they know how to work together? do they have grit? domain experience?
* market: addressable size of market, competitive landscape, positioning
* traction: do they have an MVP or prototype? What about users?
* advisors: this also includes major investors such as YC, Sequoia, and big partnerships. Essentially how quickly will they be lifted into market.
* tokenomics: weighted decision based on ico market cap, ico price, organic growth vs shilling investors
* type: bonus points goes to infrastructure, currency, or new blockchain projects.,ICOHotSheet (https://icohotsheet.com/). Our ICO rating includes the next parameters:
* idea: if the idea is unique or groundbreaking
* team: are they able to work together? do they have an ambition? domain background?
* market: targeted size of the potential audience, number and quality of the competitors, brand positioning
* track record: does the team has a minimum viable product? The number of current customers?,https://icohotsheet.com/,100,от 1 до 100,No data,No data,https://twitter.com/icohotsheet,No data,No data,No data,No data,https://www.reddit.com/user/icohotsheet,No data,https://bitcointalk.org/index.php?topic=2848024.0,No data,No data,
BlackDragon,https://www.buddhatrader.com/,My name is Dom, I’m a former banker turned crypto investor and researcher. Over the last months, I reviewed and analysed dozens of tokens and Initial Coin Offerings and shared them with the group of busy friends, all crypto enthusiasts and investors like myself. After the positive feedback received from them I decided to share it with the rest of the world in the form of a blog.,BlackDragon (https://www.buddhatrader.com/) My name is Dom, I’m an ex-banker that became a crypto market investor and analyst. My way to cryptocurrency market had started in the middle of 2017 when I purchased my first tokens - 1'500 Lisk tokens from my old friend. After I got it, I witnessed my Lisk tokens earned me 20% in two days.,https://docs.google.com/spreadsheets/d/1j2cRIVgZ4u3VRimID-ni28FhEoM-ifSQ0R5pnfEFldU/edit#gid=708419263,100,от 1 до 100,No data,No data,https://twitter.com/blackdragon_io,No data,No data,https://t.me/BlackDragonVentures,https://discordapp.com/invite/7vbvDbb,No data,No data,No data,No data,Yes,
BulkNetwork,http://bulk.network/,Глубокий разбор криптовалют и ICO проектов, основанный на мат. анализе и подкреплённый аргументированной оценкой. Наша оценка включается в глобальные рейтинги. Мы активны не только онлайн, но и в реальной жизни. Посещаем мероприятия, посвящённые блокчейну и налаживаем связи, берём интервью у организаторов проектов. ,In-depth analysis of cryptocurrencies and ICO projects based on the math. analysis and supported by a reasoned assessment. We're proud that our ICO rating is included in global ICO rankings. We are active not only online, but also in real life. We attend events dedicated to the blockchain technology and build networking, we interview the founders of the projects.,https://docs.google.com/spreadsheets/d/1SIA-geaKHkfxPghZW4-5SwC3p1JRkHlRpe5aU8LXcWU/edit#gid=1826461821,100,от 1 до 100,No data,No data,https://twitter.com/BulkNetwork,https://www.youtube.com/c/BulkNetwork,No data,https://t.me/bulknetwork,No data,No data,https://medium.com/@BulkNetwork,No data,info@bulk.network,No data,
