ICOPicker,https://icopicker.io/,Get quick and the most accurate ICO ratings, quickly compare them to make a better choice, and you can also rate or share your ICO experience. We have a very unique listing and rating procedure as our ICO ratings are not arbitrary ratings but an aggregated and sourced representation that includes ratings from top analysts, reviews from other popular ICO rating websites, and it is based on a community-driven IC rating system. We have all top ICOs listed and to keep them updated our ratings are also subject to revisions as we track the progress of the ICOs monitoring their performance during the entire token sale procedures.,ICOPicker (https://icopicker.io/) With our service crypto investors can discover the most interesting ICO project, ICO ranking and listing, easily compare them to make the best investment decision. Investors can also share their results and post reviews about ICO and their experience in the cryptocurrency market. Our team has developed a very powerful listing and rating tool by crawling dozens of ICO listing's websites and aggregating ratings from top analysts.,No data,100,от 1 до 100,No data,https://www.facebook.com/TeamICOPicker/,https://twitter.com/teamICOpicker,https://www.youtube.com/channel/UCRfwkPNL7dlwxvbhrB_vjcQ,https://t.me/icopicker,No data,No data,No data,https://medium.com/@icopicker,No data,No data,No data,
Brothers Rating,https://brothersrating.com/,Brothers Rating is a platform established by the ICO Brothers company for a detailed evaluation and rating of ICO campaigns. We were inspired by the high interest of big investors. Relying on our broad experience of participating in several hundreds of projects, they approached us to analyze some of their projects in order to manage their assets profitably.,Brothers Rating (https://brothersrating.com/) Brothers Rating is a web application launched by the ICO Brothers startup for a comprehensive evaluation and rating of ICO projects. Our team was motivated by the extremely high interest of market-makers and big investors. Taking into account our big experience of working with several hundreds of projects, we decided to develop our special ICO analysis tool that is now available for the crowd.,No data,10,A+,A,A-,B+,B,B-,C+,C,C-,D,Free/Pay,https://www.facebook.com/icobrotherscom/,https://twitter.com/brothers_rating,https://www.youtube.com/channel/UCHzWIE7XzhRhYW69u6_AV_w,https://t.me/icobrothers_global,https://t.me/brothers_rating,No data,No data,https://medium.com/@icobrothers.main,https://bitcointalk.org/index.php?topic=3450928.0,Info@brothersrating.com,Yes,
ICO Scroll,https://icoscroll.com/,ICO Scroll is an ICO directory site that’s curated by our interior full time ICO experts. Our objective is to determine the most effective possible First Coin Offerings (ICO’s) for cryptocurrency financiers as well as listing them in their corresponding classifications.,ICO Scroll (https://icoscroll.com/) ICO Scroll is an ICO web directory app that is managed by our experienced ICO analysts. ICO Scroll's goal is to discover the most promising initial coin offering by posting them in our ICO listing and help investors to take the right decisions and avoid risky projects.,No data,10,от 1 до 10,No data,https://www.facebook.com/icoscroll,https://twitter.com/icoscroll,https://www.youtube.com/channel/UCsB0lx2H6JdhZv9gu-QHH6w,https://t.me/icoscroll,No data,No data,No data,No data,https://bitcointalk.org/index.php?action=profile;u=1023335,info@icoscroll.com,No data,
ICO-map,https://www.ico-map.io/,ICO-MAP collects all the quality Active, Pre & Upcoming ICO’s, and thus we ensure that you won’t miss out on the chance to be apart of the next big thing. With ico-map.io you can put your Upcoming or Ongoing ICO on the MAP and ivestors easily can find and track ICOs.,ICO-map (https://www.ico-map.io/) ICO-MAP crawls dozens of ICO websites to gather all interesting and promising ICO projects. All ICO startups are listed by their current status: Active, Pre-Sale and Upcoming. ICO-MAP is your chance to becoma a part of some really great mind-blowing story of success. ICO-MAP isa perfect web app to track ICO industry and stay updated with the latest news.,No data,5,От 1 до 5,Free/Pay,No data,https://twitter.com/icomap_io,No data,No data,No data,No data,No data,No data,No data,info@ico-map.io,No data,
Top ICO List,https://topicolist.com,Top ICO List is curated by ICO analysts to bring you the best new ICO coins that are active, upcoming or in discounted pre ICO. ,Top ICO List (https://topicolist.com) Top ICO List is operated by an ICO analysts to provide investors with the news about the best upcomin initial coin offerings, active ICOs and discounted pre sales. Our company or any of our employees do not give any investment, financial, or legal advice.,No data,7,AAA,AA,A,BBB,BB,B,C,No data,https://www.facebook.com/topicolist,https://twitter.com/topicolist,No data,https://t.me/topicolistcommunity,https://t.me/topicolist,No data,No data,https://medium.com/@topicolist,No data,No data,No data,
ICObuzz.net,http://icobuzz.net/,ICObuzz is our view on the constantly growing ICO world. We’ve created and constantly update 3 useful lists: Active ICOs, Upcoming ICOs and Ended ICOs for everyone who is interested in ICOs and wants to stay current on the topic.,ICObuzz.net (http://icobuzz.net/) ICObuzz is how we see the continually expanding ICO galaxy. Our team has developed and continuously updates 3 helpful lists: Active, Upcoming and Ended ICOs. ICObuzz is a great platform to meet the projects build on blockchain technology. Track, analyze, invest and grow with the pace of ICO world.,No data,5,От 1 до 5,No data,https://www.facebook.com/ICObuzzOfficial,https://twitter.com/icobuzzofficial,No data,No data,No data,No data,https://www.reddit.com/r/icobuzz/,https://medium.com/@icobuzz.net,No data,info@icobuzz.net,Yes,
Tropyc,https://tropyc.co/crypto,At tropyc, we believe there is a better way to list initial coin offerings. A more valuable, less invasive way where investors and crypto-enthusiasts know there is no conflict of interest between the aggregator and the token sale issuer. A place where ICOs can get listed and rated for free but cannot advertise or promote their token sale. We are obsessively passionate about cryptocurrency and ICOs and know for a fact it will have a long-term and positive impact on our world.,Tropyc (https://tropyc.co/) Tropyc's team does believe that there's much more trustworthy way to list ICOs. A more helpful and independent tool where crypto-investors and crypto-enthusiasts can be sure - there is no conflict of interest between us and the ICO project. Tropyc is a free platform for ICOs - get listed and reviewed, but you can't promote your ICO.,No data,10,от 1 до 10,Free,https://www.facebook.com/tropyc,https://twitter.com/tropyc_crypto,No data,https://t.me/tropycHouse,https://t.me/Tropyc,No data,https://www.reddit.com/r/tropyc/,https://medium.com/@tropyc,https://bitcointalk.org/index.php?topic=4666122.0,hello@tropyc.co,Yes,
NEWSBTC,https://ico.newsbtc.com/icos/,NewsBTC is a news service that covers bitcoin news, technical analysis & forecasts for bitcoin and other altcoins. Here at NewsBTC, we are dedicated to enlightening people all around the world about bitcoin and other cryptocurrencies.,NEWSBTC (https://ico.newsbtc.com/) NewsBTC is a website with news service tool that includes BTC news, tech analysis and forecasts for BTC and other most promising altcoins. NewsBTC team's goal is to help you discover a fabulous world of bitcoin and other cryptocurrencies and be ready for any changes in the market before other investors.,No data,5,От 1 до 5,No data,https://www.facebook.com/newsbtc,https://twitter.com/newsbtc,https://www.youtube.com/channel/UC9v9erBEru5y4c3FA0wehEw,No data,https://t.me/newsbtcofficial,No data,No data,No data,No data,contact@newsbtc.com,Yes,
CoinGape,https://coingape.com/ico-review/ico-review-rating/,CoinGape ICO reviews and rating are based on in-depth analysis of projects and are analyzed against expert selected KPI’s. ICO reviews are a better way to grasp the pros and cons of a project in quick time and saves you lot of time. ,CoinGape (https://coingape.com/) Our ICO reviews and ICO rating are based on detailed analysis of ICO projects that must meet the requirements of our top experts KPIs system. ICO reviews from CoinGape's team is the best way to find whether ICO is a scam or not, get the forecasts to make the perfect investment decision.,No data,10,от 1 до 10,Pay,https://www.facebook.com/coingape,https://twitter.com/coingapemedia,https://www.youtube.com/channel/UCGxbUzJCxDHSPZkayqc4NLQ,No data,https://t.me/coingape,No data,No data,https://medium.com/@coingape,No data,hello@coingape.com,Yes,
InvestFuture,https://investfuture.ru/ico/rating,Рейтинг ICO проектов по версии InvestFuture - наиболее полный рейтинг топовых проектов, проводящих первичное размещение токенов. Мы расчитываем собственный рейтинг, анализируя рейтинги, оценки и отзывы о проектах на крупнейших ресурсах мира: ICO Bazaar, ICODrops, ICObench, ICOmarks, Track ICO, Profit Gid и другие.,The ICO rating of projects by InvestFuture is a complete rating of top projects handling initial tokens offering. We calculate our own rating by analyzing ratings, ICO rankings and reviews of ICO projects from the world's top ICO resources: ICO Bazaar, ICODrops, ICObench, ICOmarks, Track ICO, Profit Gid and others.,No data,100,От 1 до 100,No data,https://www.facebook.com/investfuture.ru,https://twitter.com/InvestFutureRu,https://www.youtube.com/channel/UC-WK8QlQJpAROCrO7dRvqcw,No data,https://t.me/investfuture,No data,No data,No data,No data,info@investfuture.ru,Yes,
Coindelite,https://coindelite.com/ico-list.php,Coindelite is the most delightful media channel to get you the Latest Bitcoin News, Cryptocurrency News, and ICO Press Releases. Check updated ICO list, Live Cryptocurrency price charts, information Cryptocurrencies and real-time market data.,Coindelite (https://coindelite.com/) Coindelite is the top digital media to deliver crypto investors the latest cryptocurrency news, ICOs PRs and bitcoin forecasts. With Coindelite you get the ICO listing, live altcoins price charts, fresh ICO reviews, and real-time market data. Coindelite is Bloomberg in the world of crypto economy.,No data,5,От 1 до 5,No data,https://www.facebook.com/coindelite/,https://twitter.com/CoinDelite,https://www.youtube.com/channel/UCT2a-WjJaZLqZuWjrn-Cong,No data,https://t.me/coindelite,No data,https://www.reddit.com/user/Coindelite/,No data,https://bitcointalk.org/index.php?topic=4789110.0,hello@coindelite.com,No data,
Icosignal,https://icosignal.com/,ICO Signal lists all the important dates of ongoing and upcoming ICOS's (Initial coin offerings) of the cryptocoin projects.,Icosignal (https://icosignal.com/) ICO Signal publish all the critical dates of ongoing and upcoming initial coin offering projects. In case you represent one of the ICOs you can submit a new entry on our list and be useful for our community.  Also, we offer advertising services for any ICO on the market, so don't hesitate con get in touch with us.,No data,5,От 1 до 5,Free/Pay,https://www.facebook.com/icosignal,https://twitter.com/icosignal,No data,No data,No data,No data,https://www.reddit.com/user/icosignal,https://medium.com/@icosignal,No data,No data,No data,
digrate,https://digrate.com/,Digital Rating Agency is the first professional provider of independent evaluation of ICO projects, digital assets and cryptocurrencies. Providing ICO project due diligence we help founders reveal pitfalls and shortcomings which may diminish a chance of raising funds. ,Digrate (https://digrate.com/) Digital Rating Agency (DRA) is the leading professional service provider of objective evaluation of initial coin offering projects, cryptocurrencies, and other digital assets. Running ICO project through due diligence procedure our team helps entrepreneurs unveil pitfalls and weaknesses which may affect the raising rounds.,No data,2 системы: 6 букв и 7 оценок,A1 - High level
A2,B1 - Satisfactory level
B2,C,D - Low level / от 1 до 7,No data,https://www.facebook.com/DigRateAgency/,https://twitter.com/@DigRateAgency,No data,No data,https://t.me/digrate,No data,No data,https://medium.com/@digitalratings,https://bitcointalk.org/index.php?topic=2208919.0,info@digrate.com,Yes,
ICOVision.io,https://icovision.io/,View more ratings and ICOs in Platform industry. Use ICOsea to access presentations, white papers, milestones, financial and tokens data.,ICOVision.io (https://icovision.io/). An ICO-focused web application that offers support to initial coin offering startups on any stage. Existing ICO project can submit a personal page about the project. As of October 2018, ICOVision.io has more than 30 categories of ICOs, blog and ICO listing. Only existing users can rate the ICOs.,No data,5,От 1 до 5,Free,No data,No data,No data,No data,No data,No data,No data,No data,No data,No data,No data,Как я понял, основывается на оценках других экспертов, которые указаны внизу страницы
FoundICO,https://foundico.com/icos/,We bring to you the best ICOs. The curated list of initial coin offerings, both ongoing and upcoming, tells you all you need to know about the winning projects in front of us. In 2018, we dig deep and try to learn all the tech details on investment opportunities in this space. Each ICO at Foundico.com goes through a semi-automatic quality check. The algorithm that accounts for over 25 criteria delivers a preliminary scoring, which is subsequently approved or adjusted by expert moderators before a project is published. We are constantly tracking trends in crypto investment and tweak calculations in order to improve objectivity of our assessments for individual projects.,FoundICO (https://foundico.com/) FoundICO takes investors to the world of the greatest ICOs. The professionally developed algorithms that create our ICOs list, both ongoing and upcoming, are your chance to dive into the crypto market with the best risk/profit balance. In early 2018, our R&D team started a research with the goal to find the best ICOs to invest and find the best opportunities in the future. As a results, now you can use our tool that ranks ICOs after tens on semi-automatic quality tests.,No data,10,от 1 до 10,No data,https://www.facebook.com/foundicoofficial/,https://twitter.com/foundico,https://www.youtube.com/channel/UCkfZAtcUyo5hSOpPLpwjNZA,No data,https://t.me/ico_expert_reviews,No data,No data,https://medium.com/@Foundico,https://bitcointalk.org/index.php?topic=2079050.0,team@foundico.com,Yes,
ICOBuffer,https://icobuffer.com,ICObuffer is an ICO listing and rating platform. We have three different rating in one score. First - profile completeness rating. Second - ICObuffer analysts rating. Third - experts rating. Our analysts have more weight in the rating methodology.,ICOBuffer (https://icobuffer.com) ICObuffer is an ICO listing and ICO rating web application. Our scoring system is base on a three steps methodology. The first step - aggregated ICO rating. The second step - experienced ICObuffer's analyst review. The third step - top experts ICO rating. Our analysts' scores have the biggest impact on the final evaluation.,No data,10,от 1 до 10,No data,https://www.facebook.com/icobuffer/,https://twitter.com/icobuffer,https://www.youtube.com/channel/UCyRek5WYdPzkBHo3352l2Ug,No data,https://t.me/ICObuffer,No data,No data,No data,https://bitcointalk.org/index.php?topic=3949738.0,info@icobuffer.com,Yes,
ICORating,https://icorating.com/,ICORating is a rating agency that issues independent analytical research, evaluating ICO projects and assigning them ratings.,ICOguru (https://icoguru.io/) - is one of the most complete and regularly updated ICO listings, that offers crypto investors a unique list of upcoming ICO projects together with lists of Pre-ICO, and Current ICOs, where users can read all important data about projects that are starting their ICO. Every week new ICOs are coming out, and on the pages of ICOguru, investors can get the list of the freshest upcoming projects. To offer crypto investors the most useful service, we've created our special consolidated ICO rating! All well-known and trusted rating providers are gathered in one place (for example, ICOrating, ICObench, etc.). Every ICO project is published with to eight different ratings (including a special rating by ICOguru). ,No data,5,negative-neutral-stable-stable+-positive,Pay,https://www.facebook.com/icorating,https://twitter.com/icorating,No data,No data,https://t.me/ico_rating,No data,https://www.reddit.com/user/ICOrating/,https://medium.com/@IcoRating/,https://bitcointalk.org/index.php?topic=1632574.0,info@icorating.com,Yes,
NeiroNIX,https://neironix.io/ico-rating,NEIRONIX is an analytical platform of multifactorial scoring of ICO projects which carries out the multivariate analysis of large amount of data using new mathematical methods. The platform is designed for the analysis and subsequent effective risk management of investments in projects with high degree of uncertainty. ,NeiroNIX (https://neironix.io/) NEIRONIX is an analytical web app of scoring of ICO projects based on multiple factors. NEIRONIX provides to investors ICO rating based on a big data analysis using new mathematical methods. NEIRONIX's app developed for risk management for investors that work with the assets powered by blockchain technology.,No data,100,от 1 до 100,Free,https://www.facebook.com/neironix/,https://twitter.com/neironix_io,https://www.youtube.com/channel/UCF8NTifpGyCsfd5U65t0LkA,https://t.me/neironix_enn,https://t.me/neironix_io,No data,https://www.reddit.com/user/Neironix_io,https://medium.com/@neironix.io,https://bitcointalk.org/index.php?topic=4836574.0,support@neironix.io,Yes,Как я понял, автоматическая система оценок на основе нейросетей еще только разрабатывается, будет работать после ico
icocra,http://icocra.com/,We are only a ratings service, but not a credit rating agency. ,Icocra (http://icocra.com/).  Icocra is only an ICO rating service, but not a CRA. We do the monthly researches to help crypto investors dive into the hottest IC opportunities and avoid risks of investments in scams. We assist you with research of all information provided by ICO teams on this our website and from other sources.,No data,9,A+,A,A-,B+,B,B-,C+,C,C-,Pay,No data,No data,No data,No data,No data,No data,No data,No data,No data,No data,Yes,Общая система оценок нигде не описывается, исходил из вариантов оценок, которые нашел у проектов
icoinspect,https://icoinspect.com/,We are the global team of investors in traditional assets and venture projects. We decided to create a service that will help all kind of investors to obtain necessary and sufficient information about ICO from technical to financial perspective. We believe, that investing in the ICO is currently one of the most promising areas of investment not only in the cryptoworld, but in the world as a whole. ICOinspect Metarating is calculated based on the published ratings and opinions from various sources. We carefully examine available ICO data and evaluate information from public sources in order to present most accurate and up to date estimate of how attractive a specific ICO is. ICOinspect Metarating has 7 grades from “A1” to “D” which resemble classic financial rating scale.,Icoinspect( https://icoinspect.com/) Icoinspect's team is a network of crypto- and traditional investors and venture capitalists from all over the world. We've launched Icoinspect to help investors of any kind to get the transparent view on the ICO project and cryptocurrencies, we offer all necessary information about initial coin offering project: from technical to financial perspective.,No data,7,A1,A2,A3,B1,B2,C,D,Free,https://www.facebook.com/icoinspect/,https://twitter.com/icoinspect,No data,No data,https://t.me/icoinspect,No data,No data,No data,https://bitcointalk.org/index.php?topic=3110555.0,info@icoinspect.com,No data,
ICOTracker,https://icotracker.net/,We are distributed team of enthusiasts. We want to make more informed investment decisions through the ICO and want to give the opportunity for all. Each project has Curator from our team. Curator makes investigation of project by following to our rules. One of them – Curator must be a real investor and making investment from own funds. Curator has an checklist to collect rating by 5 criterions. Each criterion may have 10 points in max.,ICOTracker (https://icotracker.net/) ICOTracked is a team of crypto-enthusiasts. We try to make your investment decisions safer through the ICO reviews we provide, and we want to give that opportunity for all. Each ICO startup has a manager from ICOTracked's team. The manager writes a review based on the research according to our internal rules.,No data,100,от 1 до 100,No data,No data,No data,No data,No data,No data,No data,No data,No data,https://bitcointalk.org/index.php?topic=1634726.0,info@icotracker.net,Yes,
cointelligence,https://www.cointelligence.com/content/ico_list/,Cointelligence was founded in 2017 to bridge the information gap in the crypto economy. It creates relevant tools for investors, namely an impartial and accurate ICO list and rating system. Cointelligence is dedicated to creating a platform that is honest and trustworthy. In order to help users view the market as a whole, our team of writers use their knowledge of the market from all angles to create relevant, informational articles and guides that analyze the cryptocurrency ecosystem and explain it to our audience.,Cointelligence (https://www.cointelligence.com/) Cointelligence was launched in early 2017 to build the bridge between ICOs and crypto investors, since there was a huge gap. Cointelligence's team developed relevant tools for ICO investors, actual ICO list and our unique rating system. Cointelligence goal is to help investors meet the most trustworthy ICOs.,No data,10,от 1 до 10,Free,https://www.facebook.com/cointelligence/,https://twitter.com/Cointelligencec,https://www.youtube.com/channel/UCUWTISGmB9X72P8fly19wWw,https://t.me/cointelligenceofficial,No data,No data,No data,https://medium.com/@onyavin,No data,info@Cointelligence.com,Yes,
icostock24,https://icostock24.com/projects/,Icostock24 is an informational and analytical resource where you can study full ICO list with scores from the top rating agencies like ICORATING, ICOBENCH and ICOBAZAAR at once. Explore best ICO projects and participate in token sales considering our objective ratings and reviews.,Icostock24 (https://icostock24.com/) Icostock24 is a website with analytics and news about projects built on blockchain technology for investors that are looking for a full ICO list with scores and aggregated ICO ratings from such trusted services like ICORATING, ICOBENCH and ICOBAZAAR at one place. Discover the most promising ICOs and take your chance to get involved in great raising rounds.,No data,5,от 1 до 5,Free,https://www.facebook.com/icostock24/,https://twitter.com/Icostock24,No data,No data,https://t.me/icostock24,No data,https://www.reddit.com/user/icostock24,https://medium.com/@icostock24,https://bitcointalk.org/index.php?topic=2567099.0,info@icostock24.com,No data,Оценка основывается на оценках других агентств
ICOTOP,https://icotop.io/,ICOTOP is an independent agency employing a team of blockchain experts. We specialize in making the rating for ICO projects. On the basis of our full detailed analysis, we estimate ICO projects on our rating system. It is important to note that we are an independent agency and do not partner with any blockchain projects or advertisement agencies; we work for the good of the investor. We do not just analyze openly accessible data, but also use our internet research to assess the level of risk and hidden facets of blockchain projects.,ICOTOP (https://icotop.io/) ICOTOP is an independent IC analytical agency with the experienced team of full-time experts. Our focus is the transparent methodology of ICO rating. We evaluate initial coin offering projects after analysis based on a comprehensive tests. Please, notice that ICOTOP doesn't work with any ICO project or an advertisement agency, so none of the ICOs can influence our reports.,No data,10,AA,A1,A2,A3,BB,B1,B2,CC,C1,DD,No data,https://www.facebook.com/ICOTOP.io/,https://twitter.com/ICOTOP_Rating,No data,No data,https://t.me/ICOTOP_Rating,No data,No data,No data,https://bitcointalk.org/index.php?topic=3024628.0,info@icotop.io,Yes,Не работает подписка на рассылку
Coincheckup,https://ico.coincheckup.com/,For every ICO we give you: A one-line description; Start- and end dates; The ICO and Pre-ICO price (in USD); The hard- and soft cap; A detailed description; A video, if available; Available Bonus; Available Bounty + a lot more… There’s a ton of ICO sites out there already so how can we deliver you a service that’s unique and easy to use without reinventing the wheel? We figured it would be most useful to use the Ranking system of the 2 biggest ICO sites: icobench.com and icomarks.com and give you the average score for each ICO.,Coincheckup (https://ico.coincheckup.com/) For each ICO Coincheckup offers to post:
- A short description of ICO;
- Start date;
- End date;
- The ICO and PreICO price (in $);
