Coinvision,https://www.coinvision.co/top20,Coinvision is designed to help new investors understand the cryptocurrency market. Millions of enthusiasts are buying cryptocurrencies but many don’t grasp the full potential of blockchain-powered technologies. Our AI-powered platform crawls the best websites, blogs, social media pages and channels, credible redditors and other sources to deliver alerts directly to you via Messenger & Telegram.,Coinvision (https://www.coinvision.co/) - Coinvision is developed to help crypto investors dive into the ICO market. Thousands of investors purchase cryptocurrencies, but most of them don’t gain an advatage from the potential of promising projects build on blockchain. Our platform that is powered by Artificial intelligence crawls the ICO related websites, social media pages, blogs and youtube channels, trusted popular redditors and other web sources to deliver hot news straight to you with Telegram and Facebook Messenger.,No data,100,от 1 до 100,No data,https://www.facebook.com/coinvisionbot/,https://twitter.com/coinvisiondata,No data,No data,No data,No data,No data,https://medium.com/@coinvision,No data,info@coinvision.co,No data,
@ICO_Reports Community Rating,@ICO_Reports Community Rating,No data,@ICO_Reports (Community Rating) - is a telegram channel that is posting its spreadsheet with the ICO scores, Total views, number of likes, Neutral reactions and dislikes about 65 initial coin offering projects. @ICO_Reports's spreadsheet has three colors sectors: green, yellow and red to split the ICOs into 3 types of attractiveness.,https://docs.google.com/spreadsheets/d/1vG2wEL9qbv7VzAYnUWywqTqMhDyK9Aemg-y8VS1erpc/htmlview#gid=0 ,100,от 1 до 100,No data,No data,No data,No data,No data,https://t.me/ICO_reports,No data,No data,No data,No data,No data,No data,
The Kript Keeper,http://www.thekriptkeeper.com/,I am Sin, The Kript Keeper, and you will be seeing a lot more of me doing my ICO reviews and using my spreadsheet to score them in terms of not only short term profitability for investors, but also as a means to gauge potential longevity of projects in the blockchain space.,The Kript Keeper (http://www.thekriptkeeper.com/) My name is Sin (also known as The Kript Keeper), and there's going to be a lot more of me creating the ICO reviews and using my spreadsheet to set the ratings of short-term investments in ICOs and check the possible forecasts for a long-term strategy. Every day I browse through the most promising ICOs to supply you with the hottest ICOs on the market.,https://docs.google.com/spreadsheets/d/1F60DrtAbBlBE_NHqbJNnHKN2cP830dB9sf3Obbj0n5k/edit#gid=1478142616 ,100,от 1 до 100,No data,https://www.facebook.com/thekriptkeeper,https://twitter.com/lovethyneybor,https://www.youtube.com/thekriptkeeper,https://t.me/thekript,No data,https://discordapp.com/invite/6arw63Q,No data,No data,No data,sinthekriptkeeper@gmail.com,Yes,
The Council,No data,We research and review ICOs, talk crypto projects, trading strategies and more!,The Council. The top ICO experts in the world. We make the in-depth analysis of initial coin offering projects, meet the team, aggregate the scores from the long list of ICO experts and provide crypto investors with the complete picture of the startup. We're not only about the math, we include human factors into our ICO rankings.,https://docs.google.com/spreadsheets/d/1UUae-WNQGu_cq8t6w_eMm8619Pt6fsIzrxhY5nX_SKI/edit#gid=1046695329,100,от 1 до 100,No data,No data,https://twitter.com/icocouncil,https://www.youtube.com/channel/UCTfjrDLPz3iJXRjOsaDnH_w,No data,https://t.me/CryptoInsiderX,No data,No data,No data,No data,No data,No data,
cFund,https://cfund.info/,The number of ICOs is growing every month. We study them and select the most promising and safe. In our spreadsheet you will find links and description of ICOs, detailed information and our ratings.,cFund (https://cfund.info/) The list of ICOs is increasing every day. We study them with the highest accuracy and define ICOs with the most promising future and investments safety scores. All investors in crypto can use our public spreadsheet to discover the links and descriptions of the best ICOs this year, analysis summaries and our own ratings.,https://docs.google.com/spreadsheets/d/1IskTyDIcyA0yqW2DgUwkJW4CL6PdHzEMogHblbW3oDE/htmlview#,10,от 1 до 10,No data,No data,No data,No data,No data,https://t.me/cFund_info,No data,No data,No data,No data,ico@cfund.info,No data,
ICO PROMETHEUS,No data,Top ICO's researches and alerts,ICO PROMETHEUS. Our team has developed a unique methodology of scoring ICO startups, we do believe it's a market changing solution that will change the way how ICO news reach the investors' minds. Our comprehensive initial coin offering list with an exclusive rating, not aggregated from many sources will help you to make the correct investment decisions.,https://docs.google.com/spreadsheets/d/1uS9cTOj_Ea4gNaTLL8cgMQm1yAebKuHRdufix_63ri4/edit#gid=210874663,7,A+,A,A-,B+,B,B-,C,No data,No data,https://twitter.com/Prometheus_ICO,No data,No data,https://t.me/IcoPrometheus,No data,No data,No data,No data,No data,No data,
ICO expert,https://icoexpert.biz/,ICOExpert.biz is a website and a Youtube channel about ICOs, blockchain, crypto conferences. Also, we are proud to present weekly interviews with best experts and influencers in crypto market about bitcoin, ethereum, ICOs, etc. ,ICO expert (https://icoexpert.biz/) ICOExpert.biz is a set of web application and a Youtube channel related to ICOs, blockchain and crypto conferences around the world. Besides, our team is happy to supply crypto investors with the weekly interviews with top ICO experts and enthusiasts of the crypto market about BTC, ETH, ICOs, etc. ,No data,5,От 1 до 5,No data,No data,No data,https://www.youtube.com/channel/UC6BX8GxqzSSsTfOjg9KFzxw,No data,https://t.me/icoexpertofficial,No data,No data,No data,No data,uamaksym@gmail.com,Yes,
Cryptocoinconnection,https://cryptocoinconnection.com/ICOaudits/,Crypto Connection is a leading digital media outlet and educational services company for the cryptocurrency and blockchain technology community. Our mission is to educate and connect the global cryptocurrency community in order to pioneer the future of money and economic freedom.,Cryptocoinconnection (https://cryptocoinconnection.com/) Crypto Connection is a leading digital media website and educative services startup for the crypto market and blockchain technology society. Our goal is to teach and unite the global crypto market society in order to discover the tomorrow of money and financial independence.,No data,5,От 1 до 5,No data,No data,No data,https://www.youtube.com/channel/UC22bbHu79eXYKgs70pwd3ag,No data,No data,No data,No data,No data,No data,No data,No data,
Icotoinvest,https://icotoinvest.com,Our aim is to provide you with a privileged list of ICOs that add real value to the crypto community; projects utilizing blockchain technology to create something that will revolutionize the way we do things. Some projects will be featured as basic listings, whilst others that have been reviewed by us will feature an advanced, fully informative listing structure.,,No data,10,От 1 до 10,No data,https://www.facebook.com/icotoinvest,https://twitter.com/icotoinvest,No data,No data,https://t.me/trading_experts,No data,https://www.reddit.com/user/ICOtoINVEST/,No data,No data,info@icotoinvest.com,Yes,
Chainrock,https://chainrock.io/,CHAINROCK is a digital asset research and investment group, focused on blockchain technology and cryptoassets. We strive to be a trusted resource, providing transparency and insights in the crypto space.,Chainrock (https://chainrock.io/). CHAINROCK is a digital asset analysis and financial group, sharpened on blockchain technology and crypto market. We aim to become a trusted web application, providing transparency to crypto society and insights in the crypto assets. Stay updated, subscribe for our weekly newsletters.,No data,100,От 1 до 100,No data,No data,https://twitter.com/chainrock_io,No data,No data,No data,No data,No data,https://medium.com/chainrock,No data,No data,https://chainrock.io/contact/,
ICO rating,https://www.icorating.info/icorating,We evaluate ICO projects from the point of view of a medium-term investor. We apply a clear methodology for ranking projects. We use the method of calculating points for each of the positions:
- Is there a buyback
- Is the issued token provided with real assets or not
- Does the company give a discount at the initial placement
- Does the company pay dividends
- Whether round-the-clock support of the project is established or not
- Is there a bounty program to promote the project
- And also, is the project discussed  in the media,ICO rating (https://www.icorating.info/) Our team rates the ICO projects for the best investment decisions in a medium-term. ICO rating uses a transparent technology and algorithms for ranking the projects. We use the ranking algorithms to evaluate the next positions:
- Does ICO project plan to buy the tokens back
- Is the token supported with any other financial or physical assets
- Does the ICO startup offer a discount during the initial placement
- Are the dividends being payed,No data,7,A,AA+,AA,B+,B,BB+,BB,No data,https://www.facebook.com/ico.rating.7,https://twitter.com/IcoratingI,No data,https://web.telegram.org/#/im?p=@dmitr66,No data,No data,https://www.reddit.com/user/ICOratingI/,https://medium.com/@IcoratingI,No data,No data,No data,
ICOstreet.io,https://www.icostreet.io/,Simply the best ICO list. Review our top list of ongoing and upcoming ICO (Initial Coin Offering) and crypto token crowdsales. Our rating algorithm is based on information available to ICOstreet.io.,ICOstreet.io (https://www.icostreet.io/) The best ICO list - just like that! Check our ICO list of ongoing/upcoming startups based on blockchain technology and their token sales. ICOstreet's ICO rating algorithm is based on: crawled information and our secret sources inside tens of ICOs. ICOstreet analysis based on a calculating methodology supported by the real facts we get from the teams.,No data,5,От 1 до 5,No data,No data,https://twitter.com/ICOstreet_io,No data,No data,No data,No data,No data,No data,No data,contact@icostreet.io,No data,
ICO Champs,https://www.icochamps.com/,ICO Champs is an independent ICO evaluation platform. ,ICO Champs (https://www.icochamps.com/) ICO Champs is website where entrepreneurs from crypto economy can track ICOs and get the independent ICO review. ICO Champs is your personal financial advisor in the world of initial coin offering, our team has ten+ years of experience of analysis of the ICO startups.,No data,5,От 1 до 5,Free,https://www.facebook.com/ICOchamps/,https://twitter.com/icochamps,No data,No data,No data,No data,No data,https://medium.com/icochamps,https://bitcointalk.org/index.php?action=profile;u=1689435,musli@icochamps.com,No data,
ICOcreed,https://icocreed.com/,ICOcreed is a independent ICO rating and review agency provide comprehensive list of best ICOs rated by our crypto consultant team.,ICOcreed (https://icocreed.com/) ICOcreed is an independent web application with ICO rating and reviews of initial coin offering projects. Our agency provides complete list of best and most promising ICOs rated by our crypto specialists team that has expertise 5+ years on the market. Visit our website to find the best investment opportunities!,No data,5,От 1 до 5,No data,https://www.facebook.com/ICOcreed/,https://twitter.com/icocreed,No data,No data,https://t.me/icocreed,No data,No data,https://medium.com/@icocreed2,No data,info@icocreed.com,No data,
ICO Finch,https://icofinch.com/,ICO Finch is a service which helps thousands of investors to get insight into Initial Coin Offering (ICO) market and makes it possible to ICO owners to list their projects and get more attention from potential investors. We monitor and analyze ICOs automatically using tools developed by ICO Finch team, as well as manually by our experts, and give each project our independent objective rating.,ICO Finch (https://icofinch.com/) ICO Finch is a web application which helps millions of crypto investors to get the analysis of Initial Coin Offering (ICO) market and offers to ICO owners to get listed and reviewed to attract more attention from crypto investors. Our team tracks ICOs automatically with the unique crawling software adjusted to ICO market.,No data,5,От 1 до 5,Free,https://www.facebook.com/icofinch/,https://twitter.com/ICOfinch,No data,No data,https://t.me/icofinch,No data,No data,No data,https://bitcointalk.org/index.php?topic=4803610.0,hello@icofinch.com,No data,
CryptoPotato,https://cryptopotato.com/ico-list/,CryptoPotato was established at the beginning of 2016 by crypto early adopters. CryptoPotato has recently become one of the world's leading information sources for crypto investors. We always insist on original high-quality content, and our site has set a goal to always look from the crypto investor’s point of view.,CryptoPotato (https://cryptopotato.com/) CryptoPotato was launched in early 2016 by early-birds of the crypto market. As of 2018 CryptoPotato became one of the leaders in the ICO analysis market and provides the most accurate scoring of ICOs for crypto investors. We focus on useful HQ content and post reviews to meet investors expectations.,No data,10,От 1 до 10,No data,https://www.facebook.com/CryptoPotato/,https://twitter.com/Crypto_Potato,https://www.youtube.com/channel/UCUv89KvVvjuH-NngyBhfwTg,No data,https://t.me/CryptoPotato_News,No data,No data,No data,No data,No data,Yes,
Insider.Pro,https://ihodl.com/calendars/ICO/all/,Insider.pro is an illustrated edition about cryptocurrencies and financial markets.,Insider.Pro (https://ihodl.com/) Insider.pro also known as IHODL is a rich illustrated digital media about cryptocurrencies and other high-risk financial markets. Live exchange rates, ICO listing, ICO rating, and hottest ideas to invest in the crypto economy in 2018. Also, we have the stunning daily article Key facts of the day so that you don't miss the most important news of the crypto world.,No data,5,от 1 до 5,No data,https://www.facebook.com/insider.pro.en/,https://twitter.com/InsiderProEn,https://www.youtube.com/channel/UCGd8Gpo_vbqyir-qJNbXnMA,No data,https://telegram.me/InsiderProRu,No data,No data,No data,No data,ratings@insider.pro,Yes,
@CryptoLammer,https://cryptolammer.com/,CryptoLammer want to help and build a strong crypto community.,@CryptoLammer (https://cryptolammer.com/) CryptoLammer aims to build a smart and robust crypto society. The website can be helpful with the next features: How to area, initial coin offerings (online spreadsheet), newsletter subscription, aggregated and original news about the crypto world, chat for the crypto community.,https://docs.google.com/spreadsheets/d/1Zr1jAVuroARqDr-0CuTaXXH5_bPlXkcZ8w3bn68Ms9Y/edit#gid=757935394,4,4=Green - invested or plan;  3=Yellow - neutral; 2=Blue - get on exchange;  1=Grey - not investing; ,No data,No data,https://twitter.com/CryptoLammer,No data,No data,https://t.me/CryptoLammer,No data,https://www.reddit.com/user/cryptolammer,No data,No data,CryptoLammer@gmail.com,https://cryptolammer.com/newsletter/,
Portal Soho,https://www.portalsoho.com/p/ico-calendar.html,Financial Technology, BlockChain, Cryptocurrency - News & ICO List.,Portal Soho (https://www.portalsoho.com/p/ico-calendar.html). Portal Soho covers news about fintech startups, blockchain technology, and crypto assets. Also, investors will find on our website ICO list with a rating that is created with our exclusive algorithms that have been developed for 2 years.,No data,10,от 1 до 10,No data,https://www.facebook.com/portalsoho/,https://twitter.com/PortalSoho,https://www.youtube.com/channel/UCtEcvoL4Ou9et8GMG2bbG8A,No data,No data,No data,https://www.reddit.com/user/portalsoho,No data,No data,asrinuryani96@gmail.com,Yes,
WiserICO,https://wiserico.com/,Our site provides an ICO calendar, so you can discover ICOs that suit your individual investment needs. If you want to stay ahead of the market, make sure to track our crypto ICO list and know everything about upcoming initial coin offerings.,WiserICO (https://wiserico.com/) WiserICO's website supplies crypto investors with an ICO calendar, they can always stay updated with the hottest ICO news and discover ICOs that meets investors requirements. Subscribe to WiserICO newsletters to stay updated with all news related to upcoming initial coin offerings.,No data,5,От 1 до 5,No data,https://www.facebook.com/wiserico/,https://twitter.com/wiser_ICO,No data,No data,https://t.me/wiserICO,No data,https://www.reddit.com/user/wiserico,No data,https://bitcointalk.org/index.php?topic=2844960.180,i@wiserico.com,No data,
ICO Pantera,http://icopantera.kr/,No.1 Korean ICO Review GroupAnalyze ico with objective eye. Create professional reviews Share reviews through the various channels Help investors to make accurate decisions.,ICO Pantera (http://icopantera.kr/). The number one Korean ICO review digital agency with independent ratings. ICO Pantera's team makes professional reviews of initial coin offering projects, we use the various media channels to help investors make an accurate decision. We study the most promising ICOs and set the score based on our own algorithms.,No data,No data,No data,No data,No data,No data,No data,No data,No data,No data,No data,No data,No data,No data,No data,No data
icopools.io,https://icopools.io/en/ico_analysis,ICOPOOLS.io is rating of ICO pools. Service collects data from ICO pools about LIVE deals and represents it in a useful table form sorted by rating. In adittion to rating the data can be sorted by every column in the table. Each of the pool has its history with all ICO raising rounds and their statuses described.,Icopools (https://icopools.io/) ICOPOOLS.io is an independent rating of ICO pools. This web application crawls open-source data related to ICO pools and live deals, and posts it in a helpful table-summary sorted by ICO rating. Besides, all ICO data can be sorted by columns. Every ICO pool has it's proven track record with every ICO raising round and additional information.,No data,10,от 1 до 10,Free,https://www.facebook.com/ICOPoolsio-278798262897323/,https://twitter.com/ICOpools_io,No data,https://t.me/icopoolsen,https://t.me/icopools_alerts,No data,No data,https://medium.com/@ICOpools_io,https://bitcointalk.org/index.php?topic=3314699.0,adv@icopools.io,No data,
CoinMarketPlus,https://www.coinmarketplus.com/ico-calendar/,CoinMarketPlus.com is a cutting-edge initial coin offering platform, where investors will get a detailed list of ICOs, token sales, and ICO results. With strong technical skill and decent experience in the crypto industry, our objective is to provide a substantial platform to investors; thereby they can get the well-researched information and leverage the best opportunities in initial coin offering in 2018 and beyond. Every ICO claims they have the best project to invest. At CoinMarketPlus.com our expert team read all ICOs whitepapers, check their team member’s profile, check their past achievements, compare their ICO with competitors, evaluate total supply and calculate per unit price and come up with ICO Rating. ,CoinMarketPlus (https://www.coinmarketplus.com/) CoinMarketPlus is a unique ICO rating platform, where crypto enthusiasts can get a detailed list of ICOs with the reviews, information about token sales and initial coin offering results. Our team has strong professional skills and many years of expertise in the crypto market, CoinMarketPlus goal is to provide a powerful ICO analysis platform to investors.,No data,10,От 1 до 10,No data,https://www.facebook.com/CoinMarketPlus/,https://twitter.com/coinmarketplus,https://www.youtube.com/channel/UC0wcLWoHgbLx3HV7Mwb7x1g,https://t.me/coinmarketplus,No data,No data,https://www.reddit.com/user/coinmarketplus/,https://medium.com/@coinmarketplus,https://bitcointalk.org/index.php?topic=2803593.0,info@coinmarketplus.com,Yes,
The Crypto Sphere,http://thecryptosphere.co/,I’m a 24 year old that loves learning new things (Chinese, Crypto). I’ll be reviewing ICO’s for you and hope that you find value in it.,The Crypto Sphere (http://thecryptosphere.co/) I’m 24 years old crypto enthusiast that enjoys studying new things about the crypto economy. I’ll review ICOs for informational purposes only and hope you make your investment decisions that are based on the numerous reviews and do the research on your own.,https://docs.google.com/spreadsheets/d/1hemUySXKHmBgf0DrgyQKlB-f455lUup1rPUuA-WJNoU/edit#gid=1032094084,100,От 1 до 100,No data,No data,https://twitter.com/dvircrypto,https://www.youtube.com/channel/UCGym6CYcQDzUbc4eaq7oIPw,https://t.me/cryptospheretalk,https://t.me/thecryptosphere,No data,No data,No data,No data,support@thecryptosphere.co,No data,
ICO of Korea,http://icoofkorea.com/,ICO of KOREA is the best source for ICOs and the Korean market.,ICO of Korea (http://icoofkorea.com/) Opinions of Korean investors about initial coin offerings projects. In case you're looking for the hottest Korean ICO projects, ICO of Korea rating is there for you. We have a complete listing of Korean ICOs with reviews from local experts experienced in the crypto market. You can also follow our official channel on Twitter to get the ICO news first.,https://docs.google.com/spreadsheets/d/1Mqv80g5ANqkeZNdM30aB8oqYYnJ6r2KwIBuoxIycmVI/edit#gid=1116552821,10,S,A+,A,A-,B+,B,B-,C+,C,C-,No data,No data,https://twitter.com/korea_ico,No data,No data,https://t.me/icoofkorea,No data,No data,https://medium.com/ico-of-korea,No data,No data,No data,
Altcoin Picks,No data,My goal is to bring you information about everything Cryptocurrency. I plan to cover topics such as coin reviews, coin analysis, ICO reviews and market news. ,Altcoin Picks. I aim to deliver you information about initial coin offering projects before other digital media do it. I have a lot of source inside the teams and I promise you to post the hottest news of all ongoing ICOs. Check my spreadsheet, it updates daily. Follow to see the opportunities first.,https://docs.google.com/spreadsheets/d/1TsdRNWWoVzqwLESNy8KiOmVsft5fkrImX_BZiPERpxY/edit?ts=5ae4b523#gid=0,100,от 1 до 100,No data,https://www.facebook.com/groups/1868093563217944,https://twitter.com/altcoinpicks,https://www.youtube.com/channel/UCYrQ9ZfRz_qbIy8X-ppT6dw,No data,No data,https://discordapp.com/invite/ZQNuGf5,No data,No data,No data,altcoinpicks@gmail.com,No data,
Anon ICO Reviews,https://www.youtube.com/channel/UCd8TVUSNQA0DkYgjC6-xHDg,We are a consortium of 3 crypto influencers.,Anon ICO Reviews (https://www.youtube.com/channel/UCd8TVUSNQA0DkYgjC6-xHDg). We are a team of 3 crypto enthusiasts that run this Youtube channel to help you make the right investment decisions. We will review upcoming ICOs, discuss the results of the ended and show you the great opportunities to earn a lot from your investments in initial coin offering.,No data,5,от 1 до 5,No data,https://www.facebook.com/AnonICOReview/,No data,https://www.youtube.com/channel/UCd8TVUSNQA0DkYgjC6-xHDg/,No data,No data,No data,No data,No data,No data,No data,No data,
ICOwhitelists,http://icowhitelists.com,There are two parts to how we rate ICOs here at ICOWhitelists.com. First, we need to find out if this is a quality ICO. Second, we’d like to classify the ICO so we can have an idea of what to expect in its lifetime – what class of ICO does this fall into? We include three types of quality ICOs on this website: Stellar, Solid, and Stealth ICOs.,ICOwhitelists (http://icowhitelists.com/) ICOwhitelists's ICO rating consists of 2 key points. First of all, our team finds out if an ICO is not a scam and it's a high-quality asset. On the other hand, our team tries to build a lifetime plan of the project to understand what to expect from the project in the future. ICOwhitelists has 3 types of ICOs: Stellar, Solid, and Stealth ICOs.,No data,3,Stellar, Solid, Stealth,No data,No data,https://twitter.com/ICOWhitelists,No data,No data,No data,No data,No data,No data,No data,No data,No data,
ICORanker,https://icoranker.com/,ICORanker.com is top destination for analyzing upcoming ICOs (Initial Coin Offerings). Our talented team has a years of experience in the Cryptocurrency Industry and we only list the top ICOs with the highest potential.,ICORanker (https://icoranker.com/) ICORanker.com is the best website for upcoming ICOs (Initial Coin Offerings) analysis. ICORanker's experienced team has a decade of experience in the crypto market and blockchain technology. In our ICO listings investors will find only the most promising ICO projects.,No data,100,от 1 до 100,No data,No data,No data,No data,No data,No data,No data,No data,No data,No data,info@icoranker.com,https://icoranker.com/ico-alerts,
